{
  "schema_version": 1,
  "fixture_id": "10-select",
  "provenance": "MAX_REFERENCE_CAPTURE",
  "max_executed": true,
  "captured_at_utc": "2026-10-20T11:26:22.872000Z",
  "environment": {
    "max_version": "9.1.5 (3db35fa476d), x64 windows",
    "live_version": "12.4.6 build 2026-09-10_0de5c8fa9a (installed; standalone probes do not use Live scheduler)",
    "os": "Omarchy 4.0.0.r7083.g81fd2d2; Linux 7.2.8-9-omarchy; Wine Windows 10 Pro",
    "architecture": "x86_64 host / Windows x64 Max",
    "runtime_host": "standalone_max"
  },
  "settings": {
    "sample_rate_hz": 44100,
    "signal_vector_frames": 64,
    "io_vector_frames": 512,
    "overdrive": false,
    "scheduler_in_audio_interrupt": false,
    "audio_enabled": false,
    "transport": {},
    "other": {
      "audio_driver": "ad_mme",
      "wine_version": "wine-11.13",
      "wine_distribution": "2026.08.30.1, d2d1-dcomp build 5c23dd1c + 110 patches",
      "dsp_enabled_during_message_probes": false
    },
    "unknown_fields": [
      "transport state and tempo: not queried; scores use only milliseconds",
      "native Windows/macOS behavior: not measured"
    ]
  },
  "initial_state": {
    "reset": "Freshly loaded self-created patch, original arguments and saved parameter attributes in the source patch. DSP probe must be the only open DSP patch in a fresh Max process.",
    "score": "fixtures/10-select.score.json"
  },
  "object_classes": [
    "comment",
    "js",
    "message",
    "select",
    "thispatcher"
  ],
  "files": [
    {
      "path": "fixtures/10-select.maxpat",
      "sha256": "c8aa3c7ad71cfed12646c6a0ca720fa173e07d822f099823961647d709f58c18",
      "role": "patch"
    },
    {
      "path": "fixtures/10-select.score.json",
      "sha256": "70fb38c25a56013b9f3f7faba5e10bb1e48388c4b8e017ce5016af0c07899c55",
      "role": "operations"
    },
    {
      "path": "fixtures/probe.js",
      "sha256": "1ce0ff7208b6c71a1c58c2213d4cbc598894bfdaa155d43a0f67c21f111b2e14",
      "role": "dependency"
    },
    {
      "path": "results/10-select.jsonl",
      "sha256": "6fa330b21d1d4dda844e9ade67232f6a1dd559ba415cd86bb2a7c043ef92419e",
      "role": "message_trace"
    },
    {
      "path": "expected/10-select.json",
      "sha256": "9881ba51cfde2fa851b4f471aae6e15947d194ac73bf338ae6b5e9e93d736339",
      "role": "message_trace"
    },
    {
      "path": "docs/semantic-gaps.md",
      "sha256": "9b1ff7e891c6549c421e516e75012e8c58d1abc851ccef9153e00c9fe0a3c791",
      "role": "notes"
    }
  ],
  "procedure": "Open fixtures/10-select.maxpat in a disposable copy with sibling probe.js and score JSON. The Max loadbang schedules the recorded score after 500 wall ms. See README for prefix isolation and reproduction. Do not change original projects/preferences.",
  "comparison": {
    "kind": "exact_ordered_messages",
    "absolute_tolerance": null,
    "relative_tolerance": null,
    "alignment": "DSP frame zero: first recorded frame at fresh DSP start, phase 0 cosine, ramp n/480; otherwise seq is collector arrival and wall_ms is UTC wall clock, not logical time.",
    "limitations": [
      "Only listed input messages in this fixture are observed.",
      "JS defers high-priority input; sequence reflects collector arrival.",
      "Scalar int/float selectors are preserved; numeric types within lists are unknown in this logger.",
      "Expected files are observed baselines, not independently certified oracles."
    ]
  },
  "redistribution": {
    "authorship": "Original fixtures and analysis authored for Alive local reference research; short official interface descriptions in objects.json cited separately.",
    "permission": "Self-created fixtures/results for integration into venetanji/alive. No proprietary examples, executables, license material or bundled media included.",
    "contains_proprietary_assets": false
  },
  "notes": [
    "Reference-manifest schema from integration base aa13d68; paths relative to experiments/max-reference/, not the manifests/ subdirectory.",
    "This manifest authenticates bytes and execution scope, not broad Max/MSP compatibility."
  ]
}
